<?xml version="1.0" encoding="UTF-8"?>
<tns:grabConfig xmlns:tns="http://www.dabi.com/habitv/grabconfig/entities" xmlns:xsi="http://www.w3.org/2001/XMLSchema-instance" xsi:schemaLocation="http://www.dabi.com/habitv/grabconfig/entities grab-config.xsd ">
  <plugins>
    <plugin>
      <name>name</name>
      <categories>
        <category>
          <id>id</id>
          <name>name</name>
        </category>
      </categories>
      <status>status</status>
      <deleted>true</deleted>
    </plugin>
  </plugins>
  <channel>
    <name>name</name>
    <category>
      <id>id</id>
      <name>name</name>
      <toDownload>true</toDownload>
      <include>include</include>
      <exclude>exclude</exclude>
      <category/>
      <extension>extension</extension>
      <status>0</status>
      <parameter>
        <key>key</key>
        <value>value</value>
      </parameter>
    </category>
    <status>status</status>
  </channel>
</tns:grabConfig>
